<!-- SERVICES element -->
<!ELEMENT SERVICES ( SERVICE+ ) >

<!-- SERVICE element -->
<!ELEMENT SERVICE ( #PCDATA ) >
<!ATTLIST SERVICE
	NAME CDATA #REQUIRED
	CLASS CDATA #REQUIRED >
